Couldn't open device, some information will be missing

Bus 001 Device 024: ID 2e8a:4005 RP2040 USB Research usb_case_custom_demo HID baseli
Device Descriptor:
  bLength                18
  bDescriptorType         1
  bcdUSB               2.00
  bDeviceClass          239 Miscellaneous Device
  bDeviceSubClass         2 [unknown]
  bDeviceProtocol         1 Interface Association
  bMaxPacketSize0        64
  idVendor           0x2e8a RP2040 USB Research
  idProduct          0x4005 usb_case_custom_demo HID baseli
  bcdDevice            1.00
  iManufacturer           1 RP2040 USB Research
  iProduct                2 usb_case_custom_demo HID baseli
  iSerial                 3 E6625C48939D6E22
  bNumConfigurations      1
  Configuration Descriptor:
    bLength                 9
    bDescriptorType         2
    wTotalLength       0x0022
    bNumInterfaces          1
    bConfigurationValue     1
    iConfiguration          0 
    bmAttributes         0x80
      (Bus Powered)
    MaxPower              100mA
    Interface Descriptor:
      bLength                 9
      bDescriptorType         4
      bInterfaceNumber        0
      bAlternateSetting       0
      bNumEndpoints           1
      bInterfaceClass         3 Human Interface Device
      bInterfaceSubClass      0 [unknown]
      bInterfaceProtocol      0 
      iInterface              5 
        HID Device Descriptor:
          bLength                 9
          bDescriptorType        33
          bcdHID               1.11
          bCountryCode            0 Not supported
          bNumDescriptors         1
          bDescriptorType        34 Report
          wDescriptorLength      34
          Report Descriptors: 
            ** UNAVAILABLE **
      Endpoint Descriptor:
        bLength                 7
        bDescriptorType         5
        bEndpointAddress     0x81  EP 1 IN
        bmAttributes            3
          Transfer Type            Interrupt
          Synch Type               None
          Usage Type               Data
        wMaxPacketSize     0x0010  1x 16 bytes
        bInterval              10
