Couldn't open device, some information will be missing

Bus 001 Device 012: ID 2e8a:000a Raspberry Pi Pico
Device Descriptor:
  bLength                18
  bDescriptorType         1
  bcdUSB               2.10
  bDeviceClass          239 Miscellaneous Device
  bDeviceSubClass         2 [unknown]
  bDeviceProtocol         1 Interface Association
  bMaxPacketSize0        64
  idVendor           0x2e8a Raspberry Pi
  idProduct          0x000a Pico
  bcdDevice            1.00
  iManufacturer           1 Raspberry Pi
  iProduct                2 Pico
  iSerial                 3 E6625C48939D6E22
  bNumConfigurations      1
  Configuration Descriptor:
    bLength                 9
    bDescriptorType         2
    wTotalLength       0x0054
    bNumInterfaces          3
    bConfigurationValue     1
    iConfiguration          0 
    bmAttributes         0x80
      (Bus Powered)
    MaxPower              250mA
    Interface Association:
      bLength                 8
      bDescriptorType        11
      bFirstInterface         0
      bInterfaceCount         2
      bFunctionClass          2 Communications
      bFunctionSubClass       2 Abstract (modem)
      bFunctionProtocol       0 
      iFunction               0 
    Interface Descriptor:
      bLength                 9
      bDescriptorType         4
      bInterfaceNumber        0
      bAlternateSetting       0
      bNumEndpoints           1
      bInterfaceClass         2 Communications
      bInterfaceSubClass      2 Abstract (modem)
      bInterfaceProtocol      0 
      iInterface              4 
      CDC Header:
        bcdCDC               1.20
      CDC Call Management:
        bmCapabilities       0x00
        bDataInterface          1
      CDC ACM:
        bmCapabilities       0x06
          sends break
          line coding and serial state
      CDC Union:
        bMasterInterface        0
        bSlaveInterface         1 
      Endpoint Descriptor:
        bLength                 7
        bDescriptorType         5
        bEndpointAddress     0x81  EP 1 IN
        bmAttributes            3
          Transfer Type            Interrupt
          Synch Type               None
          Usage Type               Data
        wMaxPacketSize     0x0008  1x 8 bytes
        bInterval              16
    Interface Descriptor:
      bLength                 9
      bDescriptorType         4
      bInterfaceNumber        1
      bAlternateSetting       0
      bNumEndpoints           2
      bInterfaceClass        10 CDC Data
      bInterfaceSubClass      0 [unknown]
      bInterfaceProtocol      0 
      iInterface              0 
      Endpoint Descriptor:
        bLength                 7
        bDescriptorType         5
        bEndpointAddress     0x02  EP 2 OUT
        bmAttributes            2
          Transfer Type            Bulk
          Synch Type               None
          Usage Type               Data
        wMaxPacketSize     0x0040  1x 64 bytes
        bInterval               0
      Endpoint Descriptor:
        bLength                 7
        bDescriptorType         5
        bEndpointAddress     0x82  EP 2 IN
        bmAttributes            2
          Transfer Type            Bulk
          Synch Type               None
          Usage Type               Data
        wMaxPacketSize     0x0040  1x 64 bytes
        bInterval               0
    Interface Descriptor:
      bLength                 9
      bDescriptorType         4
      bInterfaceNumber        2
      bAlternateSetting       0
      bNumEndpoints           0
      bInterfaceClass       255 Vendor Specific Class
      bInterfaceSubClass      0 [unknown]
      bInterfaceProtocol      1 
      iInterface              5 
